<!ELEMENT birthdays (monthname,bday*)>
<!ELEMENT monthname (#PCDATA)>
<!ELEMENT bday (id,name,day,month,year,notes)>
<!ELEMENT id (#PCDATA)>
<!ELEMENT name (#PCDATA)>
<!ELEMENT day (#PCDATA)>
<!ELEMENT month (#PCDATA)>
<!ELEMENT year (#PCDATA)>
<!ELEMENT notes (#PCDATA)>