<?xml version="1.0" encoding="UTF-8"?>
<?xml-stylesheet type="text/xsl" href="xslt/test.xsl"?>
<!DOCTYPE birthdays SYSTEM "birthdays.dtd">
<birthdays>
	<monthname>June</monthname>
	<bday>
		<id>7</id>
		<name>A</name>
		<day>10</day>
		<month>6</month>
		<year/>
		<notes/>
	</bday>
	<bday>
		<id>8</id>
		<name>B</name>
		<day>12</day>
		<month>6</month>
		<year>2002</year>
		<notes/>
	</bday>
</birthdays>